chromosome	gene_id	plot_label	label_for_plot	gene_start	gene_end	gene_description	overlap_conditions_observed	n_overlap_rows_used	HN_trait_best	HN_pvalue_best	HN_neglog10p_best	HN_lead_pos_best	HN_region_best	LN_trait_best	LN_pvalue_best	LN_neglog10p_best	LN_lead_pos_best	LN_region_best	NR_trait_best	NR_pvalue_best	NR_neglog10p_best	NR_lead_pos_best	NR_region_best	selection_class	known_gene_note	chosen_reason
1	Sobic.001G296300	AP2/EREBP	AP2/EREBP / Sobic.001G296300	61645804	61647145	DNA-binding domain in plant proteins such as APETALA2 and EREBPs	HN;NR; HN;LN;NR	2	X2020.HN.rachisDiameterLowe	9.6e-06	5.018	61630284	61590284-61670284	X2020.LN.primaryBranchNumbe	2.33e-06	5.633	61552313	61508962-61592944	X2020.daysToFlower.N	2.07e-06	5.684	61671043	61631043-61711043	NA	NA	Chr1 HN/LN/NR common overlap; AP2/EREBP transcription-factor candidate.
1	Sobic.001G405800	DnaJ	DnaJ / Sobic.001G405800	73165958	73170381	DnaJ protein	HN;LN;NR	1	X2020.HN.flagLeafWidt	7.19e-06	5.143	73149751	73109751-73189751	X2020.LN.plantHeigh	4.41e-06	5.356	73168282	73036014-73226287	X2021.tillersPerPlant.N	4.92e-06	5.308	73209315	73169315-73249315	NA	NA	Chr1 HN/LN/NR common overlap; DnaJ chaperone candidate.
2	Sobic.002G082100	Protein kinase	Protein kinase / Sobic.002G082100	8754671	8759766	Protein kinase domain	NR	1	X2020.HN.percentStarc	8.57e-07	6.067	8827568	8787568-8893112	X2020.LN.rachisDiameterUppe	2.4e-06	5.62	8929362	8889362-8969362	X2021.tillersPerPlant.N	2.8e-07	6.553	8783653	8734994-8849676	NA	NA	Chr2 HN/LN/NR region; protein kinase candidate.
2	Sobic.002G171500	F-box	F-box / Sobic.002G171500	55632570	55633944	F-box-like	HN	1	X2020.HN.rachisDiameterLowe	2.93e-06	5.533	55605594	55499056-55645594	X2020.LN.rachisDiameterLowe	4.12e-06	5.385	55582700	55480993-55622700	X2021.tillersPerPlant.N	1.7e-06	5.77	55561806	55521791-55608331	FST_domestication_landrace_vs_wild	NA	Chr2 HN/LN/NR region; F-box candidate with FST/domestication support in curated table.
2	Sobic.002G201900	Sugar transporter	Sugar transporter / Sobic.002G201900	60452297	60461785	Belongs to the major facilitator superfamily. Sugar transporter (TC 2.A.1.1) family	HN;LN;NR	1	X2020.HN.primaryBranchNumbe	1.68e-07	6.775	60442905	60391246-60483070	X2020.LN.primaryBranchNumbe	6.95e-07	6.158	60442905	60391850-60483263	X2021.plantHeight.N	2.73e-06	5.564	60473498	60433382-60513518	NA	NA	Chr2 direct HN/LN/NR overlap; sugar transporter candidate.
6	Sobic.006G135600	SAMDC	SAMDC / Sobic.006G135600	51261218	51262782	S-adenosylmethionine decarboxylase proenzyme	HN;LN;NR	2	X2020.HN.stemDiameterUppe	7.47e-06	5.127	51296487	51256487-51336487	X2020.LN.rachisDiameterLowe	2.49e-07	6.604	51320804	51231620-51365795	X2021.tillersPerPlant.N	5.15e-06	5.288	51252388	51212388-51292481	NA	NA	Chr6 direct HN/LN/NR overlap; S-adenosylmethionine decarboxylase/polyamine candidate.
6	Sobic.006G136500	CYP450	CYP450 / Sobic.006G136500	51310444	51312689	Belongs to the cytochrome P450 family	HN;LN	2	X2020.HN.stemDiameterUppe	7.47e-06	5.127	51296487	51256487-51336487	X2020.LN.rachisDiameterLowe	2.49e-07	6.604	51320804	51231620-51365795	X2021.tillersPerPlant.N	5.15e-06	5.288	51252388	51212388-51292481	balancing_wild_only; balancing_landrace_only	NA	Chr6 HN/LN/NR region; cytochrome P450 candidate.
9	Sobic.009G230800	Dw1	Dw1 / Sobic.009G230800	60894509	60899170	Belongs to the iron ascorbate-dependent oxidoreductase family	HN;NR; HN;LN;NR	13	X2021.HN.plantHeigh	2.39e-15	14.622	60816983	59960351-62784475	X2020.LN.plantHeigh	3.18e-13	12.498	60856964	59960689-62174173	X2020.rachisLength.N	1.22e-06	5.914	60925402	60883582-60965402	balancing_improved_only	Dw1; well-studied sorghum dwarfing/plant-height locus on chromosome 9	Chr9 Dw1; well-studied sorghum dwarfing/plant-height locus.
9	Sobic.009G239301	CTP synthase	CTP synthase / Sobic.009G239301	61504959	61505799	Catalyzes the ATP-dependent amination of UTP to CTP with either L-glutamine or ammonia as the source of nitrogen	HN; HN;LN	13	X2021.HN.plantHeigh	2.39e-15	14.622	60816983	59960351-62784475	X2020.LN.plantHeigh	3.18e-13	12.498	60856964	59960689-62174173	X2020.rachisLength.N	1.22e-06	5.914	60925402	60883582-60965402	balancing_landrace_only	NA	Chr9 nitrogen-relevant CTP synthase using glutamine/ammonia; same HN/LN/NR block.
